{"schema_version":"counter-thesis-report/2.0.0","run_id":"rrh-nested-regression-llm-overconfidence-20260908","invocation_id":"inv_16274284cb25bcc424c62ede","status":"INSUFFICIENT_EVIDENCE","agent":"runtime_skeptic","mode":"INDEPENDENT_FIRST_PASS","scope":"SEC-AAA；截至2026-01-31T23:59:59Z的冻结组合与授权 point-in-time 证据独立反证审阅。","challenges":[{"challenge_id":"CH-001","statement":"授权证据仅确认SEC-AAA在截止日前的单一收盘价，不能支持其盈利能力、资产负债表质量、竞争地位或估值合理性的判断；因此任何依赖价格稳定或该价格水平的积极解释均缺乏可检验证据。","evidence_refs":["ev-insufficient-price"],"assumption_ids":[],"resolution_evidence_needed":["截止日前、带完整来源血缘的财务业绩与指引证据。","截止日前、带完整来源血缘的资产负债表、现金流与债务到期证据。","截止日前、可用于比较估值与竞争状况的证据。"]},{"challenge_id":"CH-002","statement":"单点价格无法揭示回撤、波动性、流动性或重大事件风险。该价格可与基本面恶化、估值压缩或流动性不足并存，故不能单独排除现有50%组合持仓面临显著下行的失败路径。","evidence_refs":["ev-insufficient-price"],"assumption_ids":[],"resolution_evidence_needed":["截止日前、覆盖充分观察窗口的价格与成交流动性证据。","截止日前、公司事件、风险披露及行业环境证据。","截止日前、与该持仓相关的风险暴露和损失情景证据。"]}],"evidence_refs":["ev-insufficient-price"],"counter_evidence_refs":["ev-insufficient-price"],"uncertainties":["授权证据中的价格为100 USD/股，as_of为2026-01-30T21:00:00Z，retrieved_at为2026-01-30T21:05:00Z，且标记为FRESH；其余基本面和风险维度未知。","没有被授权的证据可用于判断价格变动原因、未来回报或SEC-AAA的内在价值。"],"data_gaps":["缺少截止日前的收入、利润率、现金流、资产负债表和管理层指引证据。","缺少估值、同行比较、行业竞争和公司催化剂证据。","缺少历史价格路径、波动性、成交流动性及下行情景证据。"],"invalidation_conditions":["若获得截止日前、来源可靠且相互一致的基本面、估值及风险证据，显示SEC-AAA的经营韧性、财务质量和风险调整后价值均有充分支持，则本反证的证据缺口将被实质缩小。","若获得截止日前的市场风险和流动性证据，显示该持仓不存在本报告所述的重大下行或流动性失败路径，则CH-002应被重新评估。"],"confidence":0.94,"confidence_rationale":"对证据不足的判断具有高置信度：获授权的唯一证据是截止日前的单一新鲜收盘价，不能覆盖基本面、估值或风险路径。该报告未对任何未获授权的事实作出断言。","skill_execution":[{"invocation_hash":"10b66451a59c43568134d86d3c9e4b475bae981587e66debcee2e65a57c8f956","skill_name":"evidence-grounding","version":"2.0.0"},{"invocation_hash":"104327b63755f3c743985527b03f25f5803a057d27e0e0a3817ef2978f923c23","skill_name":"counter-thesis","version":"2.0.0"}],"artifact_refs":[]}
