{"schema_version":"counter-thesis-report/2.0.0","run_id":"rrh-final-lock-regression-insufficient-evidence-20260908","invocation_id":"inv_151823d6a5f1ff435240e21b","status":"INSUFFICIENT_EVIDENCE","agent":"runtime_skeptic","mode":"INDEPENDENT_FIRST_PASS","scope":"SEC-AAA；截至2026-01-31T23:59:59Z，仅对获授权的单一价格证据开展独立反证研究。","challenges":[{"challenge_id":"challenge-price-only-evidence","statement":"获授权证据仅为SEC-AAA在2026-01-30T21:00:00Z的100 USD收盘价；单点价格不能验证商业表现、盈利能力、估值、催化剂或风险暴露，任何依赖这些未验证因素的正向解释均存在替代解释或失败路径。","evidence_refs":["ev-insufficient-price"],"assumption_ids":["assumption-price-sufficiency"],"resolution_evidence_needed":["截至决策截止日的财务业绩与指引证据","可追溯的估值输入与同业比较证据","重大风险、催化剂及流动性证据"]}],"evidence_refs":["ev-insufficient-price"],"counter_evidence_refs":["ev-insufficient-price"],"uncertainties":["该价格证据虽标记为FRESH，但无法单独说明价格变化的驱动因素或可持续性。","不存在获授权的基本面、估值、风险或事件证据，无法判定任何相互竞争的解释。"],"data_gaps":["缺少收入、利润率、现金流、资产负债表和管理层指引。","缺少估值倍数、盈利预期、同业基准和市场预期。","缺少公司事件、行业环境、流动性、集中度及风险敞口证据。"],"invalidation_conditions":["若取得截至决策截止日、来源可追溯且相互一致的基本面、估值、风险与催化剂证据，则“证据不足”这一反证结论失效。"],"confidence":0.15,"confidence_rationale":"对“单一收盘价不足以支撑或反驳更广泛投资论点”的判断置信度较高，但对SEC-AAA任何具体反向论点的置信度很低，因为授权范围内没有相应证据。","skill_execution":[{"invocation_hash":"c5594107bc83177bfbc984bb97a5a5e51a49e99abfe490ef415eb58c0f1d7804","skill_name":"evidence-grounding","version":"2.0.0"},{"invocation_hash":"651d896b470f90e396260879f80ef1909e9ad729380f19c6ca9e6c3996d1ee7d","skill_name":"counter-thesis","version":"2.0.0"}],"artifact_refs":[]}
