{"schema_version":"counter-thesis-report/2.0.0","run_id":"rrh-pretool-guard-insufficient-evidence-20260909","invocation_id":"inv_0c1e30a6e393a1300e98625c","status":"INSUFFICIENT_EVIDENCE","agent":"runtime_skeptic","mode":"INDEPENDENT_FIRST_PASS","scope":"SEC-AAA independent first-pass counter-thesis review through decision cutoff 2026-01-31T23:59:59Z. The authorized evidence is one fresh USD close-price observation as of 2026-01-30T21:00:00Z from fixture-market-primary.","challenges":[{"challenge_id":"CH-001","statement":"A single close-price observation of USD 100 does not establish business fundamentals, valuation, catalysts, liquidity, downside risk, or whether any proposed research thesis is robust; treating it as sufficient support would be an unsupported alternative explanation.","evidence_refs":["ev-insufficient-price"],"assumption_ids":["A-PRICE-SUFFICIENCY"],"resolution_evidence_needed":["Point-in-time financial performance and balance-sheet evidence.","Point-in-time valuation inputs and peer or market context.","Company-specific catalyst, risk, and liquidity evidence available before the decision cutoff."]}],"evidence_refs":["ev-insufficient-price"],"counter_evidence_refs":["ev-insufficient-price"],"uncertainties":["The authorized observation is fresh and identifies a close price, but it does not explain the drivers or reliability of any investment thesis.","No independent evidence is available to distinguish a justified valuation from price momentum, market-wide movement, or an idiosyncratic temporary effect."],"data_gaps":["Fundamental financial statements and operating metrics are absent.","Valuation inputs, capital structure, and comparable-company context are absent.","Catalyst calendar, adverse-event evidence, trading liquidity, and risk exposures are absent."],"invalidation_conditions":["This insufficient-evidence conclusion would be invalidated by Gate-authorized, point-in-time evidence covering fundamentals, valuation, catalysts, liquidity, and material risks before the decision cutoff."],"confidence":0.95,"confidence_rationale":"High confidence that the evidence set is insufficient: the only authorized item is one fresh close-price observation, which cannot independently support or falsify a substantive company or portfolio thesis.","skill_execution":[{"invocation_hash":"eec953881f6abc2e800157ab33feceb21cfb3a5d2e0a4a3eaef99cf5ace6fdac","skill_name":"evidence-grounding","version":"2.0.0"},{"invocation_hash":"e5d204cf708bfe33227a3110c349b623b71bad8266f535b3fdb35f85348b49b8","skill_name":"counter-thesis","version":"2.0.0"}],"artifact_refs":[]}
